08:29:21.358593 IP 192.168.3.112.35783 > 192.168.70.132.38412: sctp (1) [SCTPChunkInit]
08:29:21.358996 IP 192.168.70.132.38412 > 192.168.3.112.35783: sctp (1) [SCTPChunkInitAck]
08:29:21.359022 IP 192.168.3.112.35783 > 192.168.70.132.38412: sctp (1) [SCTPChunkCookieEcho]
08:29:21.359387 IP 192.168.70.132.38412 > 192.168.3.112.35783: sctp (1) [SCTPChunkCookieAck] [Padding]
08:29:21.359641 IP 192.168.3.112.35783 > 192.168.70.132.38412: sctp (1) [SCTPChunkData]
08:29:21.359883 IP 192.168.70.132.38412 > 192.168.3.112.35783: sctp (1) [SCTPChunkSACK]
08:29:21.360173 IP 192.168.70.132.38412 > 192.168.3.112.35783: sctp (1) [SCTPChunkData]
08:29:21.360184 IP 192.168.3.112.35783 > 192.168.70.132.38412: sctp (1) [SCTPChunkSACK]
08:29:27.335869 IP 192.168.3.100.50452 > 192.168.3.112.38472: sctp (1) [SCTPChunkInit]
08:29:27.335949 IP 192.168.3.112.38472 > 192.168.3.100.50452: sctp (1) [SCTPChunkInitAck]
08:29:27.336423 IP 192.168.3.100.50452 > 192.168.3.112.38472: sctp (1) [SCTPChunkCookieEcho]
08:29:27.336472 IP 192.168.3.112.38472 > 192.168.3.100.50452: sctp (1) [SCTPChunkCookieAck]
08:29:27.337050 IP 192.168.3.100.50452 > 192.168.3.112.38472: sctp (1) [SCTPChunkData]
08:29:27.337080 IP 192.168.3.112.38472 > 192.168.3.100.50452: sctp (1) [SCTPChunkSACK]
08:29:27.338027 IP 192.168.3.112.38472 > 192.168.3.100.50452: sctp (1) [SCTPChunkData]
08:29:27.338491 IP 192.168.3.100.50452 > 192.168.3.112.38472: sctp (1) [SCTPChunkSACK]
08:29:40.349966 IP 192.168.3.100.50452 > 192.168.3.112.38472: sctp (1) [SCTPChunkData]
08:29:40.351246 IP 192.168.3.112.38472 > 192.168.3.100.50452: sctp (1) [SCTPChunkSACK] [SCTPChunkData]
08:29:40.388744 IP 192.168.3.100.50452 > 192.168.3.112.38472: sctp (1) [SCTPChunkSACK] [SCTPChunkData]
08:29:40.390057 IP 192.168.3.112.35783 > 192.168.70.132.38412: sctp (1) [SCTPChunkData]
08:29:40.391026 IP 192.168.70.132.38412 > 192.168.3.112.35783: sctp (1) [SCTPChunkSACK] [SCTPChunkData]
08:29:40.391770 IP 192.168.3.112.38472 > 192.168.3.100.50452: sctp (1) [SCTPChunkSACK] [SCTPChunkData]
08:29:40.418601 IP 192.168.3.100.50452 > 192.168.3.112.38472: sctp (1) [SCTPChunkSACK] [SCTPChunkData]
08:29:40.419452 IP 192.168.3.112.35783 > 192.168.70.132.38412: sctp (1) [SCTPChunkSACK] [SCTPChunkData]
08:29:40.448350 IP 192.168.70.132.38412 > 192.168.3.112.35783: sctp (1) [SCTPChunkSACK] [SCTPChunkData]
08:29:40.448902 IP 192.168.3.112.38472 > 192.168.3.100.50452: sctp (1) [SCTPChunkSACK] [SCTPChunkData]
08:29:40.513626 IP 192.168.3.100.50452 > 192.168.3.112.38472: sctp (1) [SCTPChunkSACK] [SCTPChunkData]
08:29:40.514622 IP 192.168.3.112.35783 > 192.168.70.132.38412: sctp (1) [SCTPChunkSACK] [SCTPChunkData]
08:29:40.521973 IP 192.168.70.132.38412 > 192.168.3.112.35783: sctp (1) [SCTPChunkSACK] [SCTPChunkData]
08:29:40.522869 IP 192.168.3.112.38472 > 192.168.3.100.50452: sctp (1) [SCTPChunkSACK] [SCTPChunkData]
08:29:40.548615 IP 192.168.3.100.50452 > 192.168.3.112.38472: sctp (1) [SCTPChunkSACK] [SCTPChunkData]
08:29:40.549504 IP 192.168.3.112.35783 > 192.168.70.132.38412: sctp (1) [SCTPChunkSACK] [SCTPChunkData]
08:29:40.552831 IP 192.168.70.132.38412 > 192.168.3.112.35783: sctp (1) [SCTPChunkSACK] [SCTPChunkData]
08:29:40.557202 IP 192.168.3.112.38472 > 192.168.3.100.50452: sctp (1) [SCTPChunkSACK] [SCTPChunkData]
08:29:40.573742 IP 192.168.3.100.50452 > 192.168.3.112.38472: sctp (1) [SCTPChunkSACK] [SCTPChunkData]
08:29:40.576985 IP 192.168.3.112.38472 > 192.168.3.100.50452: sctp (1) [SCTPChunkSACK] [SCTPChunkData]
08:29:40.624396 IP 192.168.3.100.50452 > 192.168.3.112.38472: sctp (1) [SCTPChunkSACK] [SCTPChunkData]
08:29:40.625758 IP 192.168.3.112.35783 > 192.168.70.132.38412: sctp (1) [SCTPChunkSACK] [SCTPChunkData]
08:29:40.625803 IP 192.168.3.112.38472 > 192.168.3.100.50452: sctp (1) [SCTPChunkSACK] [SCTPChunkData]
08:29:40.648618 IP 192.168.3.100.50452 > 192.168.3.112.38472: sctp (1) [SCTPChunkSACK] [SCTPChunkData]
08:29:40.831534 IP 192.168.70.132.38412 > 192.168.3.112.35783: sctp (1) [SCTPChunkSACK]
08:29:40.831606 IP 192.168.3.112.35783 > 192.168.70.132.38412: sctp (1) [SCTPChunkData] [SCTPChunkData]
08:29:40.853307 IP 192.168.3.112.38472 > 192.168.3.100.50452: sctp (1) [SCTPChunkSACK]
08:29:41.039554 IP 192.168.70.132.38412 > 192.168.3.112.35783: sctp (1) [SCTPChunkSACK]
08:29:41.313775 IP 192.168.3.100.50452 > 192.168.3.112.38472: sctp (1) [SCTPChunkData]
08:29:41.314803 IP 192.168.3.112.35783 > 192.168.70.132.38412: sctp (1) [SCTPChunkData]
08:29:41.517301 IP 192.168.3.112.38472 > 192.168.3.100.50452: sctp (1) [SCTPChunkSACK]
08:29:41.519459 IP 192.168.70.132.38412 > 192.168.3.112.35783: sctp (1) [SCTPChunkSACK]
08:29:54.443780 IP 192.168.3.100.50452 > 192.168.3.112.38472: sctp (1) [SCTPChunkData]
08:29:54.444870 IP 192.168.3.112.35783 > 192.168.70.132.38412: sctp (1) [SCTPChunkData]
08:29:54.645298 IP 192.168.3.112.38472 > 192.168.3.100.50452: sctp (1) [SCTPChunkSACK]
08:29:54.647560 IP 192.168.70.132.38412 > 192.168.3.112.35783: sctp (1) [SCTPChunkSACK]
08:29:55.446205 IP 192.168.70.132.38412 > 192.168.3.112.35783: sctp (1) [SCTPChunkData]
08:29:55.447131 IP 192.168.3.112.38472 > 192.168.3.100.50452: sctp (1) [SCTPChunkData]
08:29:55.651481 IP 192.168.3.100.50452 > 192.168.3.112.38472: sctp (1) [SCTPChunkSACK]
08:29:55.653308 IP 192.168.3.112.35783 > 192.168.70.132.38412: sctp (1) [SCTPChunkSACK]
08:29:55.653731 IP 192.168.70.132.38412 > 192.168.3.112.35783: sctp (1) [SCTPChunkData]
08:29:55.654603 IP 192.168.3.112.38472 > 192.168.3.100.50452: sctp (1) [SCTPChunkData]
08:29:55.655783 IP 192.168.3.100.50452 > 192.168.3.112.38472: sctp (1) [SCTPChunkSACK] [SCTPChunkData]
08:29:55.656420 IP 192.168.3.112.35783 > 192.168.70.132.38412: sctp (1) [SCTPChunkSACK] [SCTPChunkData]
08:29:55.861208 IP 192.168.3.112.38472 > 192.168.3.100.50452: sctp (1) [SCTPChunkSACK]
08:29:55.863484 IP 192.168.70.132.38412 > 192.168.3.112.35783: sctp (1) [SCTPChunkSACK]
08:30:03.829914 IP 192.168.3.100.50452 > 192.168.3.112.38472: sctp (1) [SCTPChunkShutdown] [Padding]
08:30:03.829984 IP 192.168.3.112.38472 > 192.168.3.100.50452: sctp (1) [SCTPChunkShutdownAck]
08:30:03.830379 IP 192.168.3.100.50452 > 192.168.3.112.38472: sctp (1) [SCTPChunkShutdownComplete] [Padding]
08:30:04.952083 IP 192.168.3.112.35783 > 192.168.70.132.38412: sctp (1) [SCTPChunkShutdown]
08:30:04.952607 IP 192.168.70.132.38412 > 192.168.3.112.35783: sctp (1) [SCTPChunkShutdownAck] [Padding]
08:30:04.952625 IP 192.168.3.112.35783 > 192.168.70.132.38412: sctp (1) [SCTPChunkShutdownComplete]