08:29:27.335555 IP 192.168.3.100.50452 > 192.168.3.112.38472: sctp (1) [SCTPChunkInit]
08:29:27.336190 IP 192.168.3.112.38472 > 192.168.3.100.50452: sctp (1) [SCTPChunkInitAck]
08:29:27.336229 IP 192.168.3.100.50452 > 192.168.3.112.38472: sctp (1) [SCTPChunkCookieEcho]
08:29:27.336536 IP 192.168.3.112.38472 > 192.168.3.100.50452: sctp (1) [SCTPChunkCookieAck] [Padding]
08:29:27.336744 IP 192.168.3.100.50452 > 192.168.3.112.38472: sctp (1) [SCTPChunkData]
08:29:27.337180 IP 192.168.3.112.38472 > 192.168.3.100.50452: sctp (1) [SCTPChunkSACK]
08:29:27.338243 IP 192.168.3.112.38472 > 192.168.3.100.50452: sctp (1) [SCTPChunkData]
08:29:27.338299 IP 192.168.3.100.50452 > 192.168.3.112.38472: sctp (1) [SCTPChunkSACK]
08:29:40.349685 IP 192.168.3.100.50452 > 192.168.3.112.38472: sctp (1) [SCTPChunkData]
08:29:40.351411 IP 192.168.3.112.38472 > 192.168.3.100.50452: sctp (1) [SCTPChunkSACK] [SCTPChunkData]
08:29:40.388436 IP 192.168.3.100.50452 > 192.168.3.112.38472: sctp (1) [SCTPChunkSACK] [SCTPChunkData]
08:29:40.391935 IP 192.168.3.112.38472 > 192.168.3.100.50452: sctp (1) [SCTPChunkSACK] [SCTPChunkData]
08:29:40.418298 IP 192.168.3.100.50452 > 192.168.3.112.38472: sctp (1) [SCTPChunkSACK] [SCTPChunkData]
08:29:40.449059 IP 192.168.3.112.38472 > 192.168.3.100.50452: sctp (1) [SCTPChunkSACK] [SCTPChunkData]
08:29:40.513278 IP 192.168.3.100.50452 > 192.168.3.112.38472: sctp (1) [SCTPChunkSACK] [SCTPChunkData]
08:29:40.523034 IP 192.168.3.112.38472 > 192.168.3.100.50452: sctp (1) [SCTPChunkSACK] [SCTPChunkData]
08:29:40.548306 IP 192.168.3.100.50452 > 192.168.3.112.38472: sctp (1) [SCTPChunkSACK] [SCTPChunkData]
08:29:40.557365 IP 192.168.3.112.38472 > 192.168.3.100.50452: sctp (1) [SCTPChunkSACK] [SCTPChunkData]
08:29:40.573322 IP 192.168.3.100.50452 > 192.168.3.112.38472: sctp (1) [SCTPChunkSACK] [SCTPChunkData]
08:29:40.577143 IP 192.168.3.112.38472 > 192.168.3.100.50452: sctp (1) [SCTPChunkSACK] [SCTPChunkData]
08:29:40.624101 IP 192.168.3.100.50452 > 192.168.3.112.38472: sctp (1) [SCTPChunkSACK] [SCTPChunkData]
08:29:40.625929 IP 192.168.3.112.38472 > 192.168.3.100.50452: sctp (1) [SCTPChunkSACK] [SCTPChunkData]
08:29:40.648321 IP 192.168.3.100.50452 > 192.168.3.112.38472: sctp (1) [SCTPChunkSACK] [SCTPChunkData]
08:29:40.853477 IP 192.168.3.112.38472 > 192.168.3.100.50452: sctp (1) [SCTPChunkSACK]
08:29:41.313421 IP 192.168.3.100.50452 > 192.168.3.112.38472: sctp (1) [SCTPChunkData]
08:29:41.517466 IP 192.168.3.112.38472 > 192.168.3.100.50452: sctp (1) [SCTPChunkSACK]
08:29:54.443430 IP 192.168.3.100.50452 > 192.168.3.112.38472: sctp (1) [SCTPChunkData]
08:29:54.645470 IP 192.168.3.112.38472 > 192.168.3.100.50452: sctp (1) [SCTPChunkSACK]
08:29:55.447303 IP 192.168.3.112.38472 > 192.168.3.100.50452: sctp (1) [SCTPChunkData]
08:29:55.651122 IP 192.168.3.100.50452 > 192.168.3.112.38472: sctp (1) [SCTPChunkSACK]
08:29:55.654774 IP 192.168.3.112.38472 > 192.168.3.100.50452: sctp (1) [SCTPChunkData]
08:29:55.655452 IP 192.168.3.100.50452 > 192.168.3.112.38472: sctp (1) [SCTPChunkSACK] [SCTPChunkData]
08:29:55.861375 IP 192.168.3.112.38472 > 192.168.3.100.50452: sctp (1) [SCTPChunkSACK]
08:30:03.829567 IP 192.168.3.100.50452 > 192.168.3.112.38472: sctp (1) [SCTPChunkShutdown]
08:30:03.830046 IP 192.168.3.112.38472 > 192.168.3.100.50452: sctp (1) [SCTPChunkShutdownAck] [Padding]
08:30:03.830077 IP 192.168.3.100.50452 > 192.168.3.112.38472: sctp (1) [SCTPChunkShutdownComplete]